<!ELEMENT daw (modulo+)>

<!ELEMENT modulo (nombre, descripcion, codigo, profesor, fechas)>
<!ELEMENT nombre (#PCDATA)>
<!ELEMENT descripcion (#PCDATA)>
<!ELEMENT codigo (#PCDATA)>
<!ELEMENT profesor (#PCDATA)>

<!ELEMENT fechas (inicio, fin)>
<!ELEMENT inicio (dia, mes, anio)>
<!ELEMENT fin (dia, mes, anio)>
<!ELEMENT dia (#PCDATA)>
<!ELEMENT mes (#PCDATA)>
<!ELEMENT anio (#PCDATA)>
